[
  {
    "modelicaFile": "./BlockWithBlock1.mo",
    "within": "FromModelica",
    "topClassName": "FromModelica.BlockWithBlock1",
    "comment": "A block that instantiates another public and protected block",
    "public": {
      "models": [
        {
          "className": "Block1",
          "name": "bloPub",
          "comment": "A public block"
        }
      ]
    },
    "protected": {
      "models": [
        {
          "className": "Block1",
          "name": "bloPro",
          "comment": "A protected block"
        }
      ]
    }
  },
  {
    "modelicaFile": "Block1.mo",
    "within": "FromModelica",
    "topClassName": "FromModelica.Block1",
    "comment": "A block that instantiates nothing"
  }
]
